{
  "version": 1,
  "id": "jazz-blues-12-c-110",
  "title": "Jazz Blues 12-Bar Practice",
  "purpose": "Practice guide-tone movement, dominant-blues phrasing, and the VI-II-V-I turnaround over a stable twelve-bar form.",
  "key_signature": "C",
  "tempo_bpm": 110,
  "meter": [4, 4],
  "groove_preset": "jazz-swing",
  "bass_style": "auto",
  "count_in_bars": 1,
  "form": {
    "bars": 12,
    "progression_preset": "jazz-blues-12",
    "section_name": "JAZZ-BLUES-12"
  },
  "instrumentation": ["drums", "bass", "keys"]
}
